id,organization_id,title,description,mode,location_city,location_state,location_lat,location_lng,is_remote,causes,skills_needed,accessibility,tags,min_duration_min,rsvp_url,contact_email
a637fd08-c3f9-47fb-a7a8-387a6bb19f93,2,Community Support,Understand week model necessary time finally bring. Herself purpose nation bring wear. For always result whom. Democrat because usually think allow strong throughout. Maintain left avoid crime open west fact.,in_person,Stevensport,PR,34.813888,-67.423778,f,"{animal-welfare,elder-care}","{data-entry,graphic-design}",{wheelchair},"{weekday-evening,remote-ok,family-friendly}",90,http://www.vazquez.org/,ramirezjacqueline@example.org
0151cecc-c147-48e3-acf4-f24a0878f78f,2,Clinic Support,Most night second firm control. Cup head face task newspaper fire. Government choose establish people room. Ten skin opportunity seven political shake third.,in_person,Port Arthur,WI,27.379444,-78.416812,f,"{health,environment}","{mentoring,graphic-design,event-staff}",{closed-caption},"{weekday-evening,remote-ok}",60,http://www.greene.biz/,petersonlauren@example.net
5710b734-1392-42a8-a081-902e6133c2dc,3,Shelter Support,Subject beat kind ever. Course difference major perhaps glass idea. Loss fall eight usually. Degree enter successful anyone interesting. Age through improve onto.,hybrid,Yolandaberg,MT,26.977272,-80.234958,t,{animal-welfare},"{web-dev,graphic-design}",{closed-caption},"{weekday-evening,family-friendly}",180,http://west.biz/,jgalvan@example.org
aa45a65a-9584-4347-9d95-5f840164a91b,3,Clinic Support,Smile make change wish early why lose. Least example thus because fire. Else nearly hope return. Return economy close act kitchen go.,in_person,Julianside,SC,30.747626,-115.677102,f,{animal-welfare},{web-dev},{},"{weekday-evening,family-friendly,weekend}",90,https://norris.com/,craigfernandez@example.net
dd595b8a-2315-48e3-8354-123822b5b72f,3,Park Cleanup,Minute strategy charge wish from only gas. Kind himself book least soon upon writer.,virtual,,,,,t,{health},{graphic-design},{},"{skills-based,remote-ok,weekend}",90,https://nguyen.com/,wrightaaron@example.com
9f0d3b8b-43e9-4130-aeab-594626d9591d,5,STEM Mentoring,Action anyone film walk clearly. Huge hour peace rather term. East safe page perhaps his doctor still. Best scene amount improve.,in_person,West Lisaport,IA,25.793269,-77.888414,f,"{animal-welfare,elder-care}",{data-entry},{step-free},"{weekday-evening,remote-ok,skills-based}",180,https://smith-morris.com/,austinkelli@example.org
afcad70d-a19a-42b0-ba7b-59ea0e6a6a1f,2,Community Mentoring,Thank whether machine decision arm himself. Course he evidence test. Try real general rest plant tend reduce.,virtual,,,,,t,"{education,elder-care}","{data-entry,web-dev,event-staff}","{step-free,closed-caption}",{family-friendly},120,http://www.gregory.com/,gatesdavid@example.net
5ba614e3-8528-4a35-b3da-522397cf1f3b,4,Clinic Workshop,Produce thus wear. Strong head person. Still method sometimes recent head. No safe thus would involve politics own.,hybrid,Port Kiara,MH,26.994324,-117.432234,t,"{food-security,education}","{mentoring,fundraising,graphic-design}",{step-free},"{family-friendly,weekend}",90,https://evans-hall.com/,jimmymason@example.com
03a0c1c8-44e7-422e-8089-ccade9b01ed1,4,Clinic Cleanup,Front blood person street. Artist total still everybody radio matter see.,hybrid,West Cindyview,MI,32.941426,-122.583448,t,"{food-security,animal-welfare}","{graphic-design,event-staff}","{step-free,wheelchair}","{weekday-evening,skills-based}",60,http://www.potts-turner.com/,gsmith@example.com
d6a2e50f-816a-4cc3-bca7-6327e823613e,3,Shelter Cleanup,Assume hundred we hand everybody group. Prevent movie less point still wish. Lot law paper design fast teach. Put street standard situation front party arrive.,in_person,Stacytown,NV,30.870626,-119.381644,f,"{food-security,elder-care}","{data-entry,web-dev,mentoring}","{quiet-space,closed-caption}",{remote-ok},90,https://hall-carey.com/,patricia52@example.net
4ff41b87-f338-4721-af2f-fea44c47d61d,4,Clinic Support,Law moment sea that explain ask laugh. Politics learn act city item require these. Culture training tell customer magazine allow force. Act focus bar audience.,virtual,,,,,t,{elder-care},{mentoring},"{step-free,quiet-space}",{family-friendly},90,http://larson.net/,christinachavez@example.org
817e3695-81dd-445d-9cf8-8a21ea162b82,3,Park Drive,With necessary site other. Yard enter everything. Prepare choice goal. House standard and society inside.,in_person,Greenport,ID,30.836101,-73.05582,f,{food-security},{data-entry},{quiet-space},{weekday-evening},120,https://www.mills.info/,staylor@example.net
089b4129-8d03-4f33-a698-ec2398165426,4,Clinic Drive,Cold role wear thousand up security. Analysis owner they raise political none style. Forget list lawyer least.,in_person,New Williamshire,MP,34.365923,-114.116911,f,"{food-security,environment}",{fundraising},"{step-free,quiet-space}",{skills-based},90,https://www.baker.com/,fosterjoan@example.net
fa50c15f-2daa-4982-98d8-af39b9b604ab,3,Clinic Cleanup,Business west magazine commercial join become couple short. Stuff memory sister receive. Style never modern life. Sister so material at partner follow because. Street issue material feeling yourself pressure.,hybrid,Kyleville,AL,46.23967,-89.956029,t,"{education,elder-care}",{web-dev},"{step-free,quiet-space}",{family-friendly},90,http://jacobson.com/,xjohnson@example.org
152ccd86-9786-430d-afa6-fd3aaa4c81ad,5,Shelter Mentoring,Avoid popular find night. Rest enough against any everything exactly glass. There your rest above without. Recognize forget husband specific power full paper. Leg quality big commercial be fear.,virtual,,,,,t,{health},"{data-entry,web-dev,event-staff}",{step-free},"{skills-based,remote-ok,family-friendly}",60,https://leonard-williams.com/,gonzalezangela@example.org
c62030dd-c08e-4469-bd8a-ba10ce9fd8d2,3,STEM Mentoring,Occur tax home truth while. Police pressure move plant security house just. On class strategy within. Throw grow treatment take truth pattern than.,hybrid,Gentryland,KS,26.616443,-111.793778,t,"{health,environment}","{web-dev,graphic-design}",{},{weekend},60,http://garcia.com/,lisa67@example.net
13f73e20-c738-4621-bba5-7b8443abb2f5,4,STEM Workshop,Ok owner must push hard usually question. Military describe matter. Learn list popular recently family with treatment natural.,in_person,Robertsbury,HI,34.869042,-69.986761,f,"{food-security,environment}","{data-entry,graphic-design}","{step-free,closed-caption}","{remote-ok,family-friendly}",120,https://www.rivera.biz/,wwade@example.org
defe2535-786e-4c16-aa06-1d2e7201062b,1,Clinic Drive,Wide together this black treat pay leg concern. Ten line tough present happy. System either need campaign chance.,hybrid,Greenborough,IL,28.699597,-79.872037,t,{environment},"{web-dev,fundraising,graphic-design}",{wheelchair},"{weekday-evening,remote-ok,family-friendly}",180,http://www.carter-arroyo.com/,juanbailey@example.com
8853f521-f876-450a-9d02-427de5cfa1b6,5,Park Cleanup,Way minute whole. Than offer every animal none music. Partner responsibility world speak rate box politics. Different hundred work season gas blood.,virtual,,,,,t,"{education,environment}",{event-staff},"{step-free,wheelchair}","{skills-based,remote-ok,weekday-evening}",90,http://williams.com/,macdonaldlisa@example.com
7e50991c-c05b-4a2f-853e-87add891aa6f,4,Community Support,Remain south wrong difficult. Technology glass nothing hope throughout for. Energy service future know wind group employee. My edge significant summer.,hybrid,Jermaineburgh,ME,41.98245,-108.093205,t,{environment},"{data-entry,fundraising,event-staff}",{step-free},{remote-ok},90,http://sullivan-shelton.org/,andrebutler@example.com
1cce91dc-446b-4bbd-91c9-0c8ba20c3784,1,Park Workshop,Drop method because thing. Perhaps movement chair behavior song. Artist safe term half letter there. Work leader wind paper better believe. Thing memory case concern soon.,in_person,Gonzalezfurt,PW,44.852839,-115.205612,f,"{environment,elder-care}","{web-dev,fundraising,mentoring}",{closed-caption},{weekday-evening},90,http://www.lopez-washington.org/,robertsanthony@example.org
0b5ae353-92ec-4425-be8d-898e79d58d3a,5,Shelter Workshop,Yourself direction really everybody him affect. Study third natural discover. Know risk very enough say where year.,in_person,West Karen,OR,27.675033,-83.629197,f,{environment},"{web-dev,mentoring,fundraising}","{closed-caption,asl}","{skills-based,weekend}",120,https://www.webb.com/,burgessanthony@example.com
f72a8e36-6076-41f0-8a06-26430ad890cf,3,Shelter Workshop,Must remain debate special out say. That meet region seven exist. Relate live agency instead per note. Itself ever item goal. Long speech pay join those next attention.,hybrid,East Timothyfurt,OR,34.181717,-107.200973,t,{animal-welfare},"{web-dev,graphic-design,data-entry}",{},"{skills-based,weekend}",180,https://www.smith-brock.net/,hannaamy@example.org
9ba8b2dc-08e9-4c94-a38c-e25601b4115f,1,Community Cleanup,To accept month finish east. Politics task watch. Study everyone have raise. Cold several heavy crime future.,hybrid,Olsonstad,VT,40.459164,-75.690727,t,"{food-security,animal-welfare}",{mentoring},"{asl,closed-caption}","{weekday-evening,skills-based,weekend}",60,https://norris-robinson.net/,gilbertmariah@example.org
5763badf-a410-479b-967c-c13317e66ad7,1,Community Drive,Century about movement campaign whole notice rock. Also appear raise all magazine. Fill throughout court rule. Most local already up wind activity kid animal. Exist big little method.,hybrid,New Adrienne,PA,46.23282,-123.061411,t,"{animal-welfare,elder-care}",{data-entry},"{quiet-space,wheelchair}",{weekend},180,https://robertson.com/,thomas93@example.net
b963c8c2-a3fb-43e9-b386-ee0cc206f487,2,Shelter Workshop,Measure coach toward. Scientist sign physical carry. Southern agent American window. Source writer movement appear follow within.,hybrid,Nelsonfurt,IN,39.799999,-95.902032,t,"{education,environment}","{web-dev,mentoring,event-staff}",{},"{weekday-evening,remote-ok,weekend}",180,http://little.info/,cassidyconner@example.org
8d35daab-7bb2-4d0b-a0b5-c9a4bf8ff680,4,Shelter Mentoring,Term these official. Member book skill fast teacher. Change instead event simply tax stock pressure city. Free front discover sister actually.,hybrid,Marvinchester,FL,27.198872,-109.582352,t,{food-security},{graphic-design},"{step-free,closed-caption}",{skills-based},60,http://wolfe-hayes.com/,amber55@example.org
a96562be-d188-45c8-b25e-ffb7c99ad507,5,Park Drive,During three perform child even PM election. Prevent example if must have east. Owner garden well person one build.,in_person,North Danland,NJ,47.360207,-86.190844,f,{education},"{data-entry,fundraising}",{wheelchair},{remote-ok},120,https://www.hernandez.com/,brian93@example.org
67b67d0f-5f1d-4642-bd98-443454f507d9,4,Clinic Cleanup,Maybe cell car perform both really lead. Popular somebody else life. Girl edge so course father wind social.,virtual,,,,,t,{education},"{web-dev,fundraising,data-entry}","{wheelchair,asl}","{weekday-evening,skills-based,weekend}",180,https://williams.org/,bradleybryan@example.com
36d4c21c-a7ad-43a9-b9f1-e7ffaf2a4994,4,Community Cleanup,Design charge protect. Beyond begin garden course wind. Hotel must talk few situation themselves.,virtual,,,,,t,"{animal-welfare,elder-care}",{event-staff},"{wheelchair,closed-caption}","{skills-based,weekend}",60,https://www.romero-cobb.org/,jamesbrown@example.com
a9bfdf09-4f6b-46b6-81c3-026072c2bdd5,5,Clinic Mentoring,Goal financial door everybody car this. Protect yard area would up. To defense choose medical former water about let.,in_person,Port Katieport,CO,44.133031,-116.425298,f,{elder-care},{web-dev},{},"{skills-based,remote-ok}",60,http://tucker.info/,blowery@example.com
7e79cd4c-ba77-416d-b21c-451eec903b45,5,Park Cleanup,Life matter nor. Focus power leg glass eat have authority.,in_person,Lake Daniel,MH,40.657594,-68.652306,f,"{food-security,education}","{mentoring,graphic-design,event-staff}",{},{weekend},60,http://davis-reed.com/,vwhite@example.net
99fb4410-2ecf-4451-91d6-f6d58fabc6d3,4,Shelter Cleanup,Education poor safe dark gas again see. Strong environment song card like. Over against share hundred begin. Four develop stage happen hope else between. Idea grow direction.,in_person,Daniellestad,RI,44.795583,-96.421022,f,"{food-security,animal-welfare}","{web-dev,mentoring,fundraising}","{wheelchair,closed-caption}",{family-friendly},90,http://hopkins-scott.org/,deborahcruz@example.com
43380490-4c70-41e1-ac68-abab244727e3,3,Community Workshop,Bag economic place last scientist. Trial could shoulder billion practice. Collection for station. Wind you together. Discuss still article body allow.,in_person,New Johnny,ID,43.755311,-100.682572,f,"{food-security,animal-welfare}","{graphic-design,fundraising}",{quiet-space},"{skills-based,remote-ok}",120,https://www.thomas.biz/,kevin24@example.net
c2c07351-b8f8-4fb7-a32f-a14b8536ff48,5,STEM Drive,Whose value analysis value way player also. Because successful feel TV. Easy physical financial. Gas similar organization there stock week interview.,virtual,,,,,t,"{health,food-security}","{graphic-design,mentoring}",{},{weekday-evening},120,https://davis-buchanan.com/,deborah26@example.net
9fa42df3-e927-4361-97fe-231cb46b0ed1,2,Clinic Drive,Everyone during admit mention sense. Control bar partner. Would floor baby near. Again television green.,virtual,,,,,t,"{environment,elder-care}","{data-entry,fundraising,graphic-design}",{asl},{family-friendly},120,http://www.graham.com/,hopkinsmichael@example.net
0da8b034-6a5b-4768-8056-5f41f5baa4c2,4,STEM Cleanup,Kitchen continue there management but chance performance must. Activity she wide should learn somebody.,in_person,Johnville,WA,36.50772,-89.738882,f,{animal-welfare},"{web-dev,fundraising,graphic-design}",{},"{skills-based,remote-ok,weekday-evening}",120,https://www.peterson-howell.org/,justinbutler@example.org
a7ee277c-45bb-4262-ad97-3e9f6d7b8561,1,Community Drive,Test suggest water position support week. Floor onto must claim.,hybrid,West Robertstad,WA,44.086438,-107.376693,t,{health},"{web-dev,data-entry,event-staff}",{},"{skills-based,family-friendly,weekday-evening}",120,https://jackson-fields.com/,qprice@example.com
79517d7f-d273-45a7-9755-bd04696c6c3d,5,Community Workshop,Maybe lead detail manage official. Later easy start election Democrat.,hybrid,Coreyburgh,FL,26.119996,-86.970327,t,{elder-care},"{mentoring,event-staff}",{asl},"{skills-based,remote-ok,family-friendly}",120,http://www.weeks.com/,stephenmurphy@example.com
14f6c861-dcc3-43bb-a7e7-bb88c3609433,5,Shelter Drive,Computer admit choose buy marriage. Today hope thank law loss. Result civil raise memory speak.,hybrid,Lewiston,DE,47.045802,-68.914384,t,"{food-security,animal-welfare}",{event-staff},"{step-free,closed-caption}","{weekday-evening,family-friendly}",120,https://www.hebert-banks.com/,gberry@example.com
e6a5d43d-7348-4158-b243-5231bfd06af0,3,Park Mentoring,Why west dream seven school top. Follow note address. Simply parent sister effect crime role show true. Three whole manage break team.,in_person,New Brandy,TN,46.161392,-114.397296,f,{health},"{data-entry,mentoring}",{closed-caption},"{weekday-evening,remote-ok}",120,https://www.burns-torres.com/,wevans@example.org
cde526a9-094f-47cc-9b87-eb84d5f3e0e1,4,Shelter Cleanup,Themselves financial task seven north. Place land four middle significant positive. Short treat do newspaper bill.,virtual,,,,,t,{elder-care},{event-staff},"{quiet-space,closed-caption}","{skills-based,remote-ok,family-friendly}",90,https://hayden.com/,brittany65@example.com
22438d5a-027f-47f3-baa4-97f67251f486,5,Clinic Drive,Within throughout media foreign traditional like. Early development yourself.,virtual,,,,,t,"{health,education}","{data-entry,web-dev,event-staff}","{wheelchair,asl}",{weekday-evening},180,https://www.sanford.net/,fieldsnicholas@example.org
c0ff283f-44fa-4c39-852c-ed73e1f96173,2,Park Mentoring,Second agree hard though else hospital citizen. Range before industry determine inside require. Later few gas with voice.,virtual,,,,,t,"{education,environment}","{web-dev,mentoring}","{step-free,closed-caption}","{weekday-evening,skills-based}",180,https://hunt-jones.com/,william55@example.com
b44a0e36-7a85-4d95-a8c3-1599f2e3f668,2,STEM Workshop,Thus little gas action along. American single PM writer inside magazine.,hybrid,Hayesfort,WV,30.245823,-73.404214,t,"{education,animal-welfare}","{data-entry,fundraising,event-staff}","{quiet-space,asl}","{weekday-evening,skills-based,family-friendly}",60,http://www.tucker.com/,lmartin@example.org
cc86fe21-2818-46a3-9451-62a56113d0ec,3,Park Cleanup,Job need TV record remain. Good meeting modern industry human federal. Either movie be guess also our.,virtual,,,,,t,{education},"{data-entry,web-dev,graphic-design}",{},"{skills-based,weekend}",120,https://www.clark.com/,nicholas80@example.com
af019d14-36b6-463e-8d0f-e30201bb1a95,2,Shelter Workshop,Somebody growth campaign arm. Health day religious. Hotel film government floor day. Team decade only admit officer share from. Process clearly relationship painting.,virtual,,,,,t,"{education,environment}","{web-dev,fundraising,data-entry}",{wheelchair},"{skills-based,remote-ok,weekend}",180,https://www.williams.com/,garrettmccann@example.com
0df12ea2-ef1d-43a1-9f5c-ae485165568c,2,Shelter Support,Middle hit pressure need finish enjoy. Range mouth certain wide physical remember character. Above themselves right real sometimes those. Painting firm stop she sure building.,hybrid,Christinashire,MA,37.165997,-115.100515,t,{environment},"{mentoring,fundraising,event-staff}","{quiet-space,asl}",{skills-based},60,http://shaw-butler.info/,brownshawn@example.com
b18dc7e7-5673-4e57-96e2-92b006af246d,3,STEM Support,Maybe beautiful over performance back treat believe. Actually campaign believe no allow no way individual. Media opportunity cold again rule you American. Thought detail from. Early walk story Mrs cover radio.,hybrid,Kimberlychester,AS,25.764814,-85.070805,t,"{education,environment}","{web-dev,fundraising,data-entry}","{quiet-space,closed-caption}",{family-friendly},180,https://www.roberts.com/,sheri08@example.net
7e5224e2-9dcf-4664-b54f-a39643628f88,1,Community Cleanup,Room former deal include break ok. Nearly direction sort represent reduce data. Cause employee study training city responsibility.,virtual,,,,,t,{environment},"{web-dev,mentoring,fundraising}",{quiet-space},"{remote-ok,family-friendly,weekend}",120,https://rodriguez.com/,lori64@example.org
